{"abi_version":"v1.0","artifact_id":"ews4:safe_projection:b4d1d478527d2405db09bc9462a81398c9e684d710477c9db95d234c27b1976d","artifact_type":"SemanticEvidence","authority_class":"EVIDENCE_ONLY","lifecycle_state":"VALIDATED","owner_root_id":"ews4:historical_evidence_custodian","parent_refs":["ews4:safe_projection:3ca1318aadd098e64ac87b7bc83f58862f790bd474221acc37d4fd72396f5527"],"payload":{"safe_document":{"document":"orchestrator_semantic_summary_v01.json","projection_kind":"DERIVED_SAFE_EVIDENCE_ONLY","source_binding":{"input_archive_sha256":"5d6c1e7aa4bf1abbe3b2ff629ec36d85d7c2fc9bcf10cc088e87328b463992b5","source_artifacts":[{"source_artifact_id":"ews:media_source:a124f5d592e474c5f245c4a94b42de4bf598b8305eecd218c73443aea15282d6","source_canonical_sha256":"0062a6735372f774eb4f078c55de65545c9bb517d2b79bf8d6ee7bf0a3e9d007","source_payload_sha256":"c612cb9505a2c6f45becf6d727b47bc794416bbffab10ebeb63eb4297f8c23b6"},{"source_artifact_id":"frobservedwork_v02:3843df4e67f6b7d0fb18b365f052828bed6423c62e90c012d6954f7b72838501","source_canonical_sha256":"d40d2bb2a3f3041b90718f9e0e93a9542930c225caa842b5ff942360b85518ef","source_payload_sha256":"50c4af691e66744eddfd35f5f50e70e18bbd73c37086601b5a36ff7962b7444a"},{"source_artifact_id":"work_topology:543393ae7bd3c32bdc1976994e68a8c6c9fd0aeeb39661e7e5cd80328c995cf1","source_canonical_sha256":"0026a51ff39e76e3bcf627767438b8a227056e40b31bc8c56977d32009e10954","source_payload_sha256":"b84890b5d51294f89e7e6f31812f8654818cb3584c7118ea93e44b28a8bbcff4"},{"source_artifact_id":"work_results:8272dfd8b589bc4e9a1e032c82bd2b01fc6eab0f68ae4bb3ce4e525a7ba8e0df","source_canonical_sha256":"0bebe2f09f33d641114538a747d9658a200087dd035951bc12246aa5b63fcee4","source_payload_sha256":"dbfd7bf978e7a8f01d872c5399276b27e9a986e9f2d81f136d797714ec7c5b31"},{"source_artifact_id":"effect_receipt_v01:af34ec6cd8be917c78bfb0a6a29b37a81855652e3578f522a69542166e4cd34e","source_canonical_sha256":"c3de81cd6a23df52f2f4c392b86ca60a3ebb7df5bd7f28bd1fa18ebda11e10c2","source_payload_sha256":"5ae27e5e8a2c83094cf87521e3927c3ebe795db232bffb128cef6acef0744e04"}],"source_records":[{"bytes":11517,"path":"browser_run_01/complete.json","sha256":"8343c6632364affb7562c4783f7b4ac8205553f640e4a61914fe7b64dc263b0c"},{"bytes":4331,"path":"browser_run_01/fixture_sources_after.json","sha256":"5a45ef5c9a83d8427c92dff215fa0b95447a57c7ce1bbce6d3b1901ccfef3be0"},{"bytes":4331,"path":"browser_run_01/fixture_sources_before.json","sha256":"5a45ef5c9a83d8427c92dff215fa0b95447a57c7ce1bbce6d3b1901ccfef3be0"},{"bytes":1100235,"path":"browser_run_01/native_common_return/D_baseline.json","sha256":"67eff98a00873b68690ce691d9a7b5145bbf7f8802c82e2251b852b79e597d32"},{"bytes":13018741,"path":"browser_run_01/native_common_return/D_retained.json","sha256":"afd3862427d937603ee844e1392030f1194edecb1246ee0d0d88e02a3b7bd7c3"},{"bytes":1186706,"path":"browser_run_01/native_common_return/E_return.json","sha256":"f526bbfc87a2acfca47f9be53586a26dda543ae54ad742ef281d234e4caedbcd"},{"bytes":1131,"path":"browser_run_01/native_common_return/media_consumption.json","sha256":"024450f5f32e46b7fe35c8cd4646285cead83cae3c2f64d642288237a593d1e6"},{"bytes":319840,"path":"browser_run_01/native_final/report.json","sha256":"01807f6379fec720043855273a2db25580902e68d6a0242f81853d2a7251902b"},{"bytes":1650,"path":"browser_run_01/native_final/semantic_safe.json","sha256":"80bdaef645c4f1483fb3d695df48f3f8a62b049dfc52332bdf48df0c9417a423"},{"bytes":250,"path":"browser_run_01/native_final/verified_sidecar.json","sha256":"20e01b3ebd6f813bccf2ce51d23c71406a0f2b2cd706ab8bda92e71bed28a915"},{"bytes":220114,"path":"browser_run_01/observations/audio_fault_before_loss/observation.json","sha256":"81ec2b65c2bded47d2f5e9611b799dbf7bf1d27b9864453cdbb4dbee67303fab"},{"bytes":242842,"path":"browser_run_01/observations/audio_fault_before_loss/photo.png","sha256":"114187f18e0b3773feb36def9751076cf72dcd367a2fa1c3d862be0269dea298"},{"bytes":222892,"path":"browser_run_01/observations/automatic_after_E/observation.json","sha256":"2f798b451429bc215de46df8cdfea3e56a8edd35e5f81e9c43bb12c745f7bc8a"},{"bytes":242842,"path":"browser_run_01/observations/automatic_after_E/photo.png","sha256":"114187f18e0b3773feb36def9751076cf72dcd367a2fa1c3d862be0269dea298"},{"bytes":286008,"path":"browser_run_01/observations/save_candidate/observation.json","sha256":"1d8efe66f34101d3c21c1a9309c5245c2b273329d96e661fbdc13f8913716456"},{"bytes":314874,"path":"browser_run_01/observations/saved/observation.json","sha256":"1c7d3a5e466ff1569e0a3680114859cb99184e0c9586b4b320334c83f6b2b587"},{"bytes":257644,"path":"browser_run_01/observations/silent_frames/observation.json","sha256":"2008d33c2068824ad5f25f37693404c6ec8ed13087373afc4216e297f1bb11ab"},{"bytes":242842,"path":"browser_run_01/observations/silent_frames/photo.png","sha256":"114187f18e0b3773feb36def9751076cf72dcd367a2fa1c3d862be0269dea298"},{"bytes":918777,"path":"browser_run_01/temporal/after_E_before_fresh_commands.json","sha256":"a21a21eb7a76c754a0646ad31d01aa217fb2bbb0024e4a6c423c7b8eed1d311a"},{"bytes":1100609,"path":"browser_run_01/temporal/original_D_execution_bundle_projection.json","sha256":"d10c8423b379f2fa02eccea18a2e88e444091975e2964125504c5acc9b374eba"},{"bytes":264975,"path":"browser_run_01/temporal/original_immutable_material.json","sha256":"cac2ab3874b648f14fc7f39e52731f0ed9a4abbe77abcd9b2f4a47c58088b487"},{"bytes":13737,"path":"browser_run_01/workspace/phases.jsonl","sha256":"0e930ac5ff28c713e8150037faa3adad7716a64ab8877fc1f6b3f62402ca22b7"}],"supplemental_proof_manifest_sha256":"ebe40db7673ad3980083ed18e211738c64580d5872656432c9fe5c39935a98cf","verified_facts_sha256":"a8f9e4c205c0e06321564ff2641e851822dc9b2d76e051f0442689686d7f4888"},"summary":{"actual_work_consumption_verified":true,"needs":["browse","rate","select","exposure","crop","video","audio"],"semantic_role":{"mode":"CONTROLLED_DETERMINISTIC","response_sha256":"afafd78e59e88f89dae4adbcac37927e6d5358a9b3d14aa3541fcb687f858cdb","role":"ephemeral_workspace_orchestrator_llm","source_projection_ref_sha256":"6924134559dec5c76c0be419254bc8d75ead2a68ea685e3e4db866694609bb89"}}}},"schema_version":"v1","source_component":"ews4_safe_export_adapter","time_envelope":{"ct_session_anchor":"ews4:historical_evidence","et_observed_at":null,"freshness_class":"static","kt_asof":"2026-09-14T00:00:00Z","pt_created_at":"2026-09-14T00:00:00Z","ttl_seconds":0,"valid_from":null,"valid_to":null},"trace_refs":["5d6c1e7aa4bf1abbe3b2ff629ec36d85d7c2fc9bcf10cc088e87328b463992b5","orchestrator_semantic_summary_v01.json"],"transaction_id":"ews4:safe_evidence_projection"}
